003-519-925;Очень довольна покупкой. Брюки отлично сидят, стройнят. Подходят ко многим моим вещам: и к спортивным футболкам и бомберам  и к нарядным блузкам. 
004-283-764;"Люблю готовить и красиво сервироать стол, поэтому приобрела комплект ""Эмита"". Проверила на очередном семейном обеде. И красиво, и практично. Жаркое долго оставалось горячим."
003-900-174;Обажаю цветочные принты. Приобрела это платье, примерила - село отлично. Будет в чем встретить весну
004-283-832;нет
003-511-403;"Увидела эту юку на фото и сразу захотела купить, хотя ""карандашей"" у меня уже  достаточно, но эта такая оригинальная за счет вставки, не смогла удержаться и не жалею."
001-743-987;Это платье настоящая классика- и длина и покрой, такой чудесный вырез лодочкой, смогу комбинировать его разной бижутерией. Я выбрала серо-голубую расцветку-очень благородный образ
004-145-598;нет
001-602-173;Предстоит корпоратив. Выбрала это платье. Понравилось все. Очень удобное -  прямой покрой, небольшой универсальный вырез. А принт просто чудо. 
003-900-222;"Сразу запала на это платье. Давно хотела блузку с рукавом ""летучая мышь"", смотрится очень красиво, сидит отлично за счет планочки по нижнему краю, цвета принта мои. "
001-648-411;Это покрывало  я купила в спальню дочке. Понравилась красивая расцветка и качество. Комната стала выглядеть наряднее, а дочка даже стала убирать постель.
003-224-541;Купила 2-х спальный комплект. Он очень украсил спальню, даже покрывала не требуется, удобно одевается, теперь буду покупать только комплекты на молниях.
164-116;Давно искала одеяло из верблюжьей шерсти, но ведь сейчас все на синдепоне. И вот я наконец нашла то, что нужно - взяла 2-спальное одело и 2 подушки небольших размеров, их кстати тоже не просто найти, а для сна они полезней. 
003-628-340;Очень понравилась гобеленовая расцветка этого покрывала и то что его можно стирать. Комната стала выглядеть гораздо благородней.
004-023-449;Мне давно советовали подруги приобрести постельное белье с микрофиброй. И вот наконец я свободна - не нужно гладить. Это просто счастье. А бонус - чудесная расцветка, цветы, поднимающие настроение.
;
003-517-690;Почему я купила этот комплект? Во -первых я фанат  цветов, а во - вторых материал такой тонкий, воздушный, спать под ним очень приятно.
001-241-293;Очень устроило качество - микрофибра и наполнитель верблюжья шерсть. Отличное сочетание
002-788-744;Давно мечтала о таком модном жакетике - свободном, оригинальном, с брючками просто класс и совсем не полнит.
001-744-245;В моем гардеробе не хватало чего-то яркого, необычного. Ивот это платье мне подошло, я выбрала мультицветы на черном фоне. Очень эффектно. Поднимает настроение.
004-023-288;Мне нужна была такая вещь. Удобная и практичная. Очень удачный  воротник-не слишком высокий не давит. Отлично смотрится с юбкой и с брюками, с жилетом тоже хорошо сочетается.
;
004-283-835;нет
366-107;Сразу поняла, что это мое платье, такое скромное, но с изюминкой, очень стрйонит за счет отделки низа и рукава. То что нужно.
003-900-444;Такая позитивная блузочка, очень удобный рукавчик, почувствовала себя более молдой и стройной.
003-900-183;Мне понравился покрой платья. Хорошо сидит за счет кокетки и плечиков - это всегда стройнит. Расцветки тоже удачные, я выбрала с  сердечками, всем понравилось.
002-684-378;Решила, что пора готовится к весне и купила эту блузку в розовом цвете, смотрится отлично- кармашек, разрезы, пуговки - все что нам девочкам нравится.
003-942-617;Такой сквородки на моей кухне хватало. Устроила достаточно большая глубина и съемная ручка. Проверила - ничего не пригорает.
004-163-528;нет
004-277-339;нет
003-685-045;Получила этот блендер в подарок, именно такой я и хотела, уже испытала в готовке - очень простой и удобный. Готовила и мясной и рыбный фарш. Все супер.
004-277-523;нет
003-983-184;Была в гостях у подружки и впервые увидела эту штуку- мармит. Решилась купить и удивила свою семью этой красотой, плов получился чудесный и долго оставался горячим. Милые полотенечки в подарок тоже порадовали
003-693-992;Удобная сковорода, устроила глубина и возможность говить на индукционной плите, легко моется.
002-212-700;Я поклонница индукционных плит. Использую такую дома - все готовится очень быстор. Вода закипает моментально. Эту плитку приобрела для дачи, хочу комфорта.
003-003-462;Мне понравился фасон блузы, удачная отделка, сочетание цветов, я выбрала розовый с серым, очень освежает. Удобно, что низ блузы на манжете.
;
001-609-109;Решила себя порадовать, пусть действительно зимой расцветают цветы. Платье сидит отлично, дополнительно украшают широкие манжеты. Буду создавать позитив себе и окружающим.
004-291-808;Мне подошел фасон этого платья, сидит очень хорошо, но главное оригинальная расцветка-создается впечатление вытканого рисунка на однотонном фоне.
001-712-120;Купила это платье - покрой мой и принт, который мне всегда нравился - восточные мотивы, очень подходит моему образу.
004-283-851;нет
004-283-850;нет
004-283-842;нет
002-792-544;
001-648-404;Давно искала покрывало размером евро-макси и наконец повезло, да еще такое чудесное качество -шелк! Цветы на нем, как живые, периливаются. Спальня стала совсем другой.
004-023-649;Иногда хочется себя побаловать, вот купила новое постельное белье и мое утро действительно стало цветочным. Понравилось также качество материала и то, что не требуется глажка.
;
003-628-374;Понравилась расцветка и качество, удобно. Что можно стирать,  использую и как плед, если хочется поваляться днем.
004-023-294;Приобрела такой комплект для дачи, мы бываем там и зимой, вот и пусть нас радуют снежные ромашки, с качеством такого белья я уже знакома и оно меня не подводило.
003-770-422;Купила такое покрывало для спальни дочки, пусть оно создает ей хорошее и спокой ное натроение, понравилось качество, особенно то, что заявлена гипоаллергенность
;
002-207-647;Часто пеку. Очень устроил этот набор - все три формы разъемные. Разные размеры позволят испечь оазные коржи, сделать ступенчатый торт, уже попробовала-получилось отлично.
003-955-681;Мне нравятся красиво нарезанные овощи, руками это сделать трудно. Да и долго, а эта овощерезка, которую я приобрела позволяет мне все сделать быстро и красиво Набор тряпочек тоже конечно пригодился.
003-875-118;сковородки очень качественные и удобные. Ручка съемная. Блинная сковородочка однозначно мне пригодится, тем более,что скоро масленица.
004-277-525;нет
004-277-527;нет
004-277-530;нет
003-799-200;Очень удобный набор, мне часто требуются сковородки разного размера. Съемные ручки позволяют экономить место и ставить сковородку в духовку. Надежность антинагарного покрытия я уже проверила - отличное.
003-900-203;Эта блузка созлает мне  хорошее настроение. Чудесный принт, сочетается со многими вещами из моего гардероба.
671-203;Купила такое платье, чувствую себя в нем прекрасно, удобный покрой, удачная длин рукава, а сама ткань создает впечатление кружева. На работе всем очень понравилось.
004-283-839;Понравилась блузка белого цвета с красивым рисунком, нарядно и модно, асимиртричная длина - очень современно. Ношу с большим удовольствием.
079-058;Платье хорошо сидит, принт мне понравился, украшает однотонная отделка по низу платья и рукава
140-363;"Мне очень подошла эта блуза, очень хорошо сидит за счет рукава ""летучая мышь"" и планки по низу.  Выбрала цвет морской волны с фиолетовым рисунком. Красота."
002-496-504;Выбрала платье молочного цвета, люблю трикотажные вещи, взяла на размер больше, как и советовали, очень хорошо село, выглядит очень нарядно.
001-853-543;Взяла это покрывало в подарок сестре. Зная ее вкус, несомневалась, что ей понравится эта красота и не ошиблась
004-023-337;Выбирала постельное белье и остановилась на этом варианте. Застелила постель и осталась очень довольна. Надеюсь, что качество тоже не подведет
;
002-412-450;Покрывало мне понравилось, я люблю жаккардовую ткань, рисунок очень нежный, подошел к стилю моей спальни.
004-023-652;Обажаю розы. Сама их выращиваю, поэтому выбрала этот комплект. К тому же микрофибре я доверяю-отлично стирается и не нужно гладить.
003-770-420;Не смогла устоять, взяла этот плед, такая чудесная расцветка, прямо веришь. Что весна придет.
;
004-236-540;Это колечко мне подарила мама на пятнадцатилетие, мне оно очень понравилось, а когда прочитала надпись, то чуть не расплакалась. Всегда буду его носить.
124-254;Выбрала для себя этот браслет, очень понравилось плетение. На руке смотрится очень нежно
004-236-541;нет
001-718-589;Я не была крещена при рождении и вот решила пройти обряд крещения уже во взрослом возрасте, очень понравился и подошел мне зтот крестик. Сделан искусно и надпись такая проникновенная
003-847-379;Выбрал это кольцо в подарок своей маме. Оно очень подошло- руки у нее красивые, да и аметист ее камень
003-847-387;очень люблю серьги с крупными камнями, а цвет аметиста вообще завораживает, поэтому решила сделать себе подарок и не ошиблась. Очень мне подошли
002-384-439;нет
139-008;нет
002-021-769;Я по знаку зодиака весы. Никак не удавалось найти достойную подвеску, а тут все сошлось. Очень удачный дизайн. Спасибо.
004-236-541;нет
004-236-605;нет
004-236-606;нет
003-679-662;Купила такую блузу в фиолетовых тонах, понравилось, как сидит, а цветочный принт очень украшает
003-965-737;Очень подошла мне   поравилась абстрактная расцветка,  удачный  покрой и особенно оригинальный ворот
001-763-890;нет
004-283-836;нет
004-283-834;нет
003-447-858;нет
Блуза «Огнеса»;нет
001-599-763;Чудесное платье. Я выбрала на бежевом фоне. Покрой простой, но за счет рисунка выглядит роскошно
002-506-408;Я купила это покрывало и оно действительно роскошное, выглядит даже лучше, чем на картинке.
004-023-295;Считаю, что постельное белье обязательно должно быть красивым, у меня много разных комплектов, а теперь буде и этот с чудесными цветами
;
003-628-332;Хотелось чего-то в стиле прованс, вот и купила это покрывало. Настроение поднялось.
004-023-654;Очень красивый и яркий комплект. Купила для подарка детям и как оказалось угодила
003-578-163;Купила этот плнд и поняла что его нежная расцветка действительно освежает комнату.
004-236-609;нет
004-236-610;нет
001-823-476;Кольцо простое, но очень изящное, понравились алмазные грани и сакроментальная надпись, поэтому решила его купить
;
003-311-609;Муж подарил мне эту цепочку и я очень довольна. Понравилось изящное плетение, удобный и надежный замочек
004-236-618;Кольцо просто роскошное, крупное,как я люблю и 7 чудесных топазов, мне очень понравлся этот подарок
004-236-619;нет
121-374;наконец-то подобрала кольцо к своей жемчужной подвеске. Очень красивая работа- жемчужина в нежных объятиях. Романтично
121-375;Эти серьги мне подарили коллеги по ра боте на день рождения. Знают. Что я люблю жемчуг. Дизай очень понравился- очень красиво вплетена жемчужина в ажурную поддержку
001-803-271;Подарил этот гарнитур своей жене, знаю. Что она любит изящные украшения. Приятно, что ей понравилось.
